startsecond	text
12.34	Chris Anderson:
12.34	Elon, hey, welcome back to TED.
15.38	It's great to have you here.
16.78	Elon Musk: Thanks for having me.
18.38	CA: So, in the next half hour or so,
21.26	we're going to spend some time
23.1	exploring your vision for what
23.1	an exciting future might look like,
27.02	which I guess makes
27.02	the first question a little ironic:
31.14	Why are you boring?
32.9	EM: Yeah.
34.14	I ask myself that frequently.
39.06	We're trying to dig a hole under LA,
43.22	and this is to create the beginning
46.42	of what will hopefully
46.42	be a 3D network of tunnels
51.34	to alleviate congestion.
53.58	So right now, one of the most
53.58	soul-destroying things is traffic.
59.14	It affects people
59.14	in every part of the world.
62.02	It takes away so much of your life.
65.86	It's horrible.
67.86	It's particularly horrible in LA.
69.5	(Laughter)
72.18	CA: I think you've brought with you
74.14	the first visualization
74.14	that's been shown of this.
76.62	Can I show this?
77.98	EM: Yeah, absolutely.
77.98	So this is the first time --
80.7	Just to show what we're talking about.
82.58	So a couple of key things
82.58	that are important
84.74	in having a 3D tunnel network.
88.66	First of all, you have to be able
90.3	to integrate the entrance
90.3	and exit of the tunnel
92.58	seamlessly into the fabric of the city.
94.66	So by having an elevator,
98.34	sort of a car skate,
98.34	that's on an elevator,
103.14	you can integrate the entrance
103.14	and exits to the tunnel network
107.1	just by using two parking spaces.
110.66	And then the car gets on a skate.
112.78	There's no speed limit here,
114.18	so we're designing this to be able
114.18	to operate at 200 kilometers an hour.
119.22	CA: How much?
120.46	EM: 200 kilometers an hour,
120.46	or about 130 miles per hour.
124.62	So you should be able
124.62	to get from, say, Westwood to LAX
130.86	in six minutes -- five, six minutes.
133.14	(Applause)
137.5	CA: So possibly, initially done,
139.1	it's like on a sort
139.1	of toll road-type basis.
141.42	EM: Yeah.
142.66	CA: Which, I guess,
142.66	alleviates some traffic
144.74	from the surface streets as well.
146.46	EM: So, I don't know
146.46	if people noticed it in the video,
149.1	but there's no real limit
149.1	to how many levels of tunnel you can have.
154.26	You can go much further deep
154.26	than you can go up.
157.1	The deepest mines are much deeper
157.1	than the tallest buildings are tall,
161.3	so you can alleviate any arbitrary
161.3	level of urban congestion
166.58	with a 3D tunnel network.
167.9	This is a very important point.
169.46	So a key rebuttal to the tunnels
169.46	is that if you add one layer of tunnels,
175.86	that will simply alleviate congestion,
175.86	it will get used up,
178.66	and then you'll be back where you started,
178.66	back with congestion.
181.98	But you can go to any
181.98	arbitrary number of tunnels,
184.42	any number of levels.
185.78	CA: But people -- seen traditionally,
185.78	it's incredibly expensive to dig,
189.34	and that would block this idea.
191.14	EM: Yeah.
192.86	Well, they're right.
194.1	To give you an example,
194.1	the LA subway extension,
197.9	which is -- I think it's
197.9	a two-and-a-half mile extension
201.58	that was just completed
201.58	for two billion dollars.
203.843	So it's roughly a billion dollars a mile
203.843	to do the subway extension in LA.
209.26	And this is not the highest
209.26	utility subway in the world.
213.26	So yeah, it's quite difficult
213.26	to dig tunnels normally.
217.78	I think we need to have
217.78	at least a tenfold improvement
220.98	in the cost per mile of tunneling.
223.98	CA: And how could you achieve that?
228.06	EM: Actually, if you just do two things,
230.14	you can get to approximately
230.14	an order of magnitude improvement,
233.5	and I think you can go beyond that.
235.7	So the first thing to do
235.7	is to cut the tunnel diameter
239.98	by a factor of two or more.
241.62	So a single road lane tunnel
241.62	according to regulations
245.62	has to be 26 feet,
245.62	maybe 28 feet in diameter
248.5	to allow for crashes
248.5	and emergency vehicles
251.7	and sufficient ventilation
251.7	for combustion engine cars.
255.98	But if you shrink that diameter
255.98	to what we're attempting,
259.58	which is 12 feet, which is plenty
259.58	to get an electric skate through,
263.26	you drop the diameter by a factor of two
266.5	and the cross-sectional area
266.5	by a factor of four,
270.42	and the tunneling cost scales
270.42	with the cross-sectional area.
273.3	So that's roughly a half-order
273.3	of magnitude improvement right there.
276.54	Then tunneling machines currently tunnel
276.54	for half the time, then they stop,
281.46	and then the rest of the time
281.46	is putting in reinforcements
284.66	for the tunnel wall.
285.98	So if you design the machine instead
288.22	to do continuous
288.22	tunneling and reinforcing,
290.58	that will give you
290.58	a factor of two improvement.
292.82	Combine that and that's a factor of eight.
295.06	Also these machines are far from being
295.06	at their power or thermal limits,
299.74	so you can jack up the power
299.74	to the machine substantially.
302.82	I think you can get
302.82	at least a factor of two,
304.98	maybe a factor of four or five
304.98	improvement on top of that.
309.18	So I think there's a fairly
309.18	straightforward series of steps
313.42	to get somewhere in excess
313.42	of an order of magnitude improvement
316.42	in the cost per mile,
318.18	and our target actually is --
321.14	we've got a pet snail called Gary,
323.98	this is from Gary the snail
323.98	"from ""South Park,"""
326.54	"I mean, sorry, ""SpongeBob SquarePants."""
329.5	(Laughter)
331.1	So Gary is capable of --
335.54	currently he's capable
335.54	of going 14 times faster
339.66	than a tunnel-boring machine.
341.46	(Laughter)
344.26	CA: You want to beat Gary.
346.06	EM: We want to beat Gary.
347.38	(Laughter)
348.94	He's not a patient little fellow,
351.18	and that will be victory.
354.3	Victory is beating the snail.
357.1	CA: But a lot of people imagining,
357.1	dreaming about future cities,
360.18	they imagine that actually
360.18	the solution is flying cars, drones, etc.
364.1	You go aboveground.
366.34	Why isn't that a better solution?
368.18	You save all that tunneling cost.
370.18	EM: Right. I'm in favor of flying things.
372.42	Obviously, I do rockets,
372.42	so I like things that fly.
376.3	This is not some inherent bias
376.3	against flying things,
379.26	but there is a challenge with flying cars
382.34	in that they'll be quite noisy,
385.66	the wind force generated
385.66	will be very high.
391.82	Let's just say that if something's
391.82	flying over your head,
394.54	a whole bunch of flying cars
394.54	going all over the place,
398.26	that is not an anxiety-reducing situation.
402.9	(Laughter)
405.02	You don't think to yourself,
405.02	"""Well, I feel better about today."""
410.34	You're thinking,
410.34	"""Did they service their hubcap,"
412.98	or is it going to come off
412.98	"and guillotine me?"""
415.9	Things like that.
420.14	CA: So you've got this vision
421.74	of future cities with these rich,
421.74	3D networks of tunnels underneath.
427.06	Is there a tie-in here with Hyperloop?
429.1	Could you apply these tunnels
429.1	to use for this Hyperloop idea
432.66	you released a few years ago.
434.66	EM: Yeah, so we've been
434.66	sort of puttering around
437.9	with the Hyperloop stuff for a while.
440.54	We built a Hyperloop test track
440.54	adjacent to SpaceX,
444.38	just for a student competition,
446.54	to encourage innovative
446.54	ideas in transport.
449.58	And it actually ends up being
449.58	the biggest vacuum chamber in the world
454.62	after the Large Hadron Collider,
457.62	by volume.
461.14	So it was quite fun to do that,
461.14	but it was kind of a hobby thing,
466.62	and then we think we might --
470.34	so we've built a little pusher car
470.34	to push the student pods,
476.26	but we're going to try seeing
476.26	how fast we can make the pusher go
480.22	if it's not pushing something.
482.54	So we're cautiously optimistic
484.9	we'll be able to be faster
484.9	than the world's fastest bullet train
489.94	even in a .8-mile stretch.
492.22	CA: Whoa. Good brakes.
494.78	EM: Yeah, I mean, it's -- yeah.
497.06	It's either going to smash
497.06	into tiny pieces or go quite fast.
501.7	CA: But you can picture,
501.7	then, a Hyperloop in a tunnel
505.3	running quite long distances.
507.14	EM: Exactly.
508.86	And looking at tunneling technology,
510.66	it turns out that
510.66	in order to make a tunnel,
513.22	you have to --
516.14	In order to seal against the water table,
518.54	you've got to typically design
518.54	a tunnel wall to be good
523.22	to about five or six atmospheres.
526.979	So to go to vacuum is only one atmosphere,
530.02	or near-vacuum.
531.46	So actually, it sort of turns out
531.46	that automatically,
535.9	if you build a tunnel that is good enough
535.9	to resist the water table,
539.9	it is automatically
539.9	capable of holding vacuum.
542.34	CA: Huh.
543.98	EM: So, yeah.
545.54	CA: And so you could actually picture,
547.42	what kind of length tunnel
547.42	is in Elon's future to running Hyperloop?
553.14	EM: I think there's no real length limit.
556.38	You could dig as much as you want.
559.42	I think if you were to do something
561.66	like a DC-to-New York Hyperloop,
566.86	I think you'd probably want
566.86	to go underground the entire way
569.74	because it's a high-density area.
571.38	You're going under
571.38	a lot of buildings and houses,
575.46	and if you go deep enough,
577.02	you cannot detect the tunnel.
579.42	Sometimes people think,
579.42	well, it's going to be pretty annoying
582.38	to have a tunnel dug under my house.
584.26	Like, if that tunnel is dug
585.62	more than about three or four
585.62	tunnel diameters beneath your house,
588.82	you will not be able
588.82	to detect it being dug at all.
592.7	In fact, if you're able
592.7	to detect the tunnel being dug,
599.42	whatever device you are using,
601.06	you can get a lot of money
601.06	for that device from the Israeli military,
604.35	who is trying to detect
604.35	tunnels from Hamas,
607.456	and from the US Customs and Border patrol
607.456	that try and detect drug tunnels.
612.26	So the reality is
615.5	that earth is incredibly good
615.5	at absorbing vibrations,
619.38	and once the tunnel depth
619.38	is below a certain level,
622.38	it is undetectable.
624.38	Maybe if you have a very sensitive
624.38	seismic instrument,
626.98	you might be able to detect it.
629.1	CA: So you've started
629.1	a new company to do this
631.5	called The Boring Company.
633.22	Very nice. Very funny.
635.18	(Laughter)
636.58	EM: What's funny about that?
638.1	(Laughter)
640.74	CA: How much of your time is this?
643.42	EM: It's maybe ...
647.5	two or three percent.
649.26	CA: You've bought a hobby.
650.58	This is what an Elon Musk
650.58	hobby looks like.
653.34	(Laughter)
654.38	EM: I mean, it really is, like --
656.86	This is basically interns
656.86	and people doing it part time.
663.14	We bought some second-hand machinery.
667.86	It's kind of puttering along,
667.86	but it's making good progress, so --
671.82	CA: So an even bigger part of your time
673.74	is being spent on electrifying
673.74	cars and transport through Tesla.
679.26	Is one of the motivations
679.26	for the tunneling project
681.86	the realization that actually,
684.42	in a world where cars are electric
684.42	and where they're self-driving,
687.86	there may end up being
687.86	more cars on the roads
691.42	on any given hour than there are now?
693.82	EM: Yeah, exactly.
697.86	A lot of people think
697.86	that when you make cars autonomous,
702.18	they'll be able to go faster
702.18	and that will alleviate congestion.
706.82	And to some degree that will be true,
708.74	but once you have shared autonomy
708.74	where it's much cheaper to go by car
713.82	and you can go point to point,
716.78	the affordability of going in a car
716.78	will be better than that of a bus.
721.94	Like, it will cost less than a bus ticket.
724.18	So the amount of driving that will occur
724.18	will be much greater with shared autonomy,
729.26	and actually traffic will get far worse.
732.14	CA: You started Tesla
732.14	with the goal of persuading the world
736.42	that electrification
736.42	was the future of cars,
739.58	and a few years ago,
739.58	people were laughing at you.
741.98	Now, not so much.
744.46	EM: OK.
745.7	(Laughter)
747.66	I don't know. I don't know.
749.9	CA: But isn't it true that pretty much
749.9	every auto manufacturer
753.34	has announced
753.34	serious electrification plans
756.38	for the short- to medium-term future?
759.82	EM: Yeah. Yeah.
763.1	I think almost every automaker
763.1	has some electric vehicle program.
768.1	They vary in seriousness.
769.38	Some are very serious
769.38	about transitioning entirely to electric,
773.7	and some are just dabbling in it.
777.1	And some, amazingly,
777.1	are still pursuing fuel cells,
779.54	but I think that won't last much longer.
781.7	CA: But isn't there a sense, though, Elon,
783.78	where you can now just declare victory
783.78	"and say, you know, ""We did it."""
787.5	Let the world electrify,
787.5	and you go on and focus on other stuff?
793.34	EM: Yeah.
796.14	I intend to stay with Tesla
796.14	as far into the future as I can imagine,
800.74	and there are a lot of exciting
800.74	things that we have coming.
805.42	Obviously the Model 3 is coming soon.
807.62	We'll be unveiling the Tesla Semi truck.
811.94	CA: OK, we're going to come to this.
813.9	So Model 3, it's supposed
813.9	to be coming in July-ish.
818.9	EM: Yeah, it's looking quite good
818.9	for starting production in July.
823.46	CA: Wow.
824.86	One of the things
824.86	that people are so excited about
827.26	is the fact that it's got autopilot.
830.5	And you put out this video a while back
832.86	showing what that technology
832.86	would look like.
838.22	EM: Yeah.
839.46	CA: There's obviously autopilot
839.46	in Model S right now.
841.99	What are we seeing here?
843.38	EM: Yeah, so this is using
843.38	only cameras and GPS.
849.42	So there's no LIDAR
849.42	or radar being used here.
851.94	This is just using passive optical,
851.94	which is essentially what a person uses.
857.02	The whole road system
857.02	is meant to be navigated
859.54	with passive optical, or cameras,
863.62	and so once you solve cameras
866.98	or vision,
869.54	then autonomy is solved.
871.06	If you don't solve vision,
871.06	it's not solved.
873.94	So that's why our focus is
873.94	so heavily on having a vision neural net
879.98	that's very effective for road conditions.
883.22	CA: Right. Many other people
883.22	are going the LIDAR route.
885.86	You want cameras plus radar is most of it.
888.74	EM: You can absolutely
888.74	be superhuman with just cameras.
892.14	Like, you can probably do it
892.14	ten times better than humans would,
895.18	just cameras.
896.46	CA: So the new cars being sold right now
896.46	have eight cameras in them.
900.94	They can't yet do what that showed.
905.3	When will they be able to?
908.26	EM: I think we're still on track
908.26	for being able to go cross-country
914.02	from LA to New York by the end
914.02	of the year, fully autonomous.
918.22	CA: OK, so by the end
918.22	of the year, you're saying,
922.02	someone's going to sit in a Tesla
922.02	without touching the steering wheel,
926.02	"tap in ""New York,"" off it goes."
928.54	EM: Yeah.
929.78	CA: Won't ever have to touch the wheel --
929.78	by the end of 2017.
934.1	EM: Yeah. Essentially,
934.1	November or December of this year,
938.74	we should be able to go all the way
938.74	from a parking lot in California
943.18	to a parking lot in New York,
944.86	no controls touched at any point
944.86	during the entire journey.
948.62	(Applause)
950.66	CA: Amazing.
951.9	But part of that is possible
953.34	because you've already got a fleet
953.34	of Teslas driving all these roads.
956.78	You're accumulating a huge amount
956.78	of data of that national road system.
963.26	EM: Yes, but the thing
963.26	that will be interesting
965.94	is that I'm actually fairly confident
965.94	it will be able to do that route
972.78	even if you change the route dynamically.
976.66	So, it's fairly easy --
979.86	If you say I'm going to be really good
979.86	at one specific route, that's one thing,
983.62	but it should be able to go,
983.62	really be very good,
988.78	certainly once you enter a highway,
990.54	to go anywhere on the highway system
993.34	in a given country.
995.86	So it's not sort of limited
995.86	to LA to New York.
998.18	We could change it
998.18	and make it Seattle-Florida,
1001.66	that day, in real time.
1004.22	So you were going from LA to New York.
1006.38	Now go from LA to Toronto.
1010.14	CA: So leaving aside
1010.14	regulation for a second,
1012.9	in terms of the technology alone,
1015.7	the time when someone
1015.7	will be able to buy one of your cars
1019.54	and literally just take the hands
1019.54	off the wheel and go to sleep
1023.38	and wake up and find that they've arrived,
1025.46	how far away is that, to do that safely?
1027.42	EM: I think that's about two years.
1029.7	So the real trick of it
1029.7	is not how do you make it work
1033.1	say 99.9 percent of the time,
1036.06	because, like, if a car crashes
1036.06	one in a thousand times,
1040.179	then you're probably still not going
1040.179	to be comfortable falling asleep.
1047.34	You shouldn't be, certainly.
1048.9	(Laughter)
1051.86	It's never going to be perfect.
1054.78	No system is going to be perfect,
1056.54	but if you say it's perhaps --
1060.34	the car is unlikely to crash
1062.78	in a hundred lifetimes,
1062.78	or a thousand lifetimes,
1066.26	then people are like, OK, wow,
1066.26	if I were to live a thousand lives,
1070.18	I would still most likely
1070.18	never experience a crash,
1072.82	then that's probably OK.
1074.22	CA: To sleep.
1075.46	I guess the big concern of yours
1075.46	is that people may actually
1078.34	get seduced too early
1078.34	to think that this is safe,
1080.65	and that you'll have some horrible
1080.65	incident happen that puts things back.
1085.22	EM: Well, I think that the autonomy system
1085.22	is likely to at least mitigate the crash,
1091.26	except in rare circumstances.
1094.1	The thing to appreciate
1094.1	about vehicle safety
1096.42	is this is probabilistic.
1100.74	I mean, there's some chance that any time
1100.74	a human driver gets in a car,
1104.22	that they will have an accident
1104.22	that is their fault.
1107.18	It's never zero.
1109.26	So really the key threshold for autonomy
1113.66	is how much better does autonomy
1113.66	need to be than a person
1118.1	before you can rely on it?
1119.5	CA: But once you get
1119.5	literally safe hands-off driving,
1122.94	the power to disrupt
1122.94	the whole industry seems massive,
1125.78	because at that point you've spoken
1125.78	of people being able to buy a car,
1130.18	drops you off at work,
1130.18	and then you let it go
1132.34	and provide a sort of Uber-like
1132.34	service to other people,
1136.34	earn you money,
1137.58	maybe even cover the cost
1137.58	of your lease of that car,
1140.06	so you can kind of get a car for free.
1141.94	Is that really likely?
1143.22	EM: Yeah. Absolutely
1143.22	this is what will happen.
1146.1	So there will be a shared autonomy fleet
1148.1	where you buy your car
1149.38	and you can choose
1149.38	to use that car exclusively,
1152.82	you could choose to have it be used
1152.82	only by friends and family,
1156.54	only by other drivers
1156.54	who are rated five star,
1161.62	you can choose to share it sometimes
1161.62	but not other times.
1167.94	That's 100 percent what will occur.
1171.26	It's just a question of when.
1173.78	CA: Wow.
1175.02	So you mentioned the Semi
1177.26	and I think you're planning
1177.26	to announce this in September,
1180.02	but I'm curious whether there's
1180.02	anything you could show us today?
1183.14	EM: I will show you
1183.14	a teaser shot of the truck.
1187.02	(Laughter)
1189.54	It's alive.
1191.5	CA: OK.
1192.74	EM: That's definitely a case
1192.74	where we want to be cautious
1195.46	about the autonomy features.
1198.18	Yeah.
1199.42	(Laughter)
1201.06	CA: We can't see that much of it,
1202.7	but it doesn't look like
1202.7	just a little friendly neighborhood truck.
1205.94	It looks kind of badass.
1207.22	What sort of semi is this?
1210.98	EM: So this is a heavy duty,
1210.98	long-range semitruck.
1215.58	So it's the highest weight capability
1219.86	and with long range.
1222.94	So essentially it's meant to alleviate
1222.94	the heavy-duty trucking loads.
1229.1	And this is something which
1229.1	people do not today think is possible.
1234.42	They think the truck doesn't have enough
1234.42	power or it doesn't have enough range,
1238.18	and then with the Tesla Semi
1240.74	we want to show that no, an electric truck
1243.42	actually can out-torque any diesel semi.
1249.46	And if you had a tug-of-war competition,
1253.62	the Tesla Semi
1253.62	will tug the diesel semi uphill.
1258.7	(Laughter)
1260.98	(Applause)
1262.86	CA: That's pretty cool.
1262.86	And short term, these aren't driverless.
1265.9	These are going to be trucks
1265.9	that truck drivers want to drive.
1270.3	EM: Yes. So what will be
1270.3	really fun about this
1272.94	is you have a flat torque RPM curve
1272.94	with an electric motor,
1278.34	whereas with a diesel motor or any kind
1278.34	of internal combustion engine car,
1281.86	you've got a torque RPM curve
1281.86	that looks like a hill.
1285.66	So this will be a very spry truck.
1288.62	You can drive this
1288.62	around like a sports car.
1291.5	There's no gears.
1291.5	It's, like, single speed.
1293.9	CA: There's a great movie
1293.9	to be made here somewhere.
1296.38	I don't know what it is
1296.38	and I don't know that it ends well,
1299.18	but it's a great movie.
1300.42	(Laughter)
1301.46	EM: It's quite bizarre test-driving.
1304.22	When I was driving the test prototype
1304.22	for the first truck.
1308.26	It's really weird,
1308.26	because you're driving around
1310.54	and you're just so nimble,
1310.54	and you're in this giant truck.
1313.66	CA: Wait, you've
1313.66	already driven a prototype?
1317.18	EM: Yeah, I drove it
1317.18	around the parking lot,
1319.3	and I was like, this is crazy.
1320.78	CA: Wow. This is no vaporware.
1322.98	EM: It's just like,
1322.98	driving this giant truck
1325.1	and making these mad maneuvers.
1327.1	CA: This is cool.
1327.1	OK, from a really badass picture
1329.58	to a kind of less badass picture.
1332.22	This is just a cute house
1332.22	"from ""Desperate Housewives"" or something."
1335.58	What on earth is going on here?
1338.66	EM: Well, this illustrates
1338.66	the picture of the future
1341.14	that I think is how things will evolve.
1344.14	You've got an electric car
1344.14	in the driveway.
1346.5	If you look in between
1346.5	the electric car and the house,
1350.26	there are actually three Powerwalls
1350.26	stacked up against the side of the house,
1354.14	and then that house roof is a solar roof.
1356.98	So that's an actual solar glass roof.
1359.1	CA: OK.
1360.34	EM: That's a picture of a real --
1360.34	well, admittedly, it's a real fake house.
1364.62	That's a real fake house.
1366.3	(Laughter)
1369.42	CA: So these roof tiles,
1371.3	some of them have in them
1371.3	basically solar power, the ability to --
1377.46	EM: Yeah. Solar glass tiles
1379.18	where you can adjust
1379.18	the texture and the color
1384.3	to a very fine-grained level,
1386.3	and then there's
1386.3	sort of microlouvers in the glass,
1391.9	such that when you're looking
1391.9	at the roof from street level
1395.38	or close to street level,
1397.1	all the tiles look the same
1399.5	whether there is a solar cell
1399.5	behind it or not.
1405.82	So you have an even color
1409.26	from the ground level.
1412.78	If you were to look at it
1412.78	from a helicopter,
1414.9	you would be actually able
1414.9	to look through and see
1417.3	that some of the glass tiles have
1417.3	a solar cell behind them and some do not.
1421.34	You can't tell from street level.
1422.98	CA: You put them in the ones
1422.98	that are likely to see a lot of sun,
1426.06	and that makes these roofs
1426.06	super affordable, right?
1428.46	They're not that much more expensive
1428.46	than just tiling the roof.
1431.46	EM: Yeah.
1433.66	We're very confident
1433.66	that the cost of the roof
1437.66	plus the cost of electricity --
1441.74	A solar glass roof will be less
1441.74	than the cost of a normal roof
1444.7	plus the cost of electricity.
1446.14	So in other words,
1447.42	this will be economically a no-brainer,
1451.78	we think it will look great,
1453.5	and it will last --
1455.66	We thought about having
1455.66	the warranty be infinity,
1458.74	but then people thought,
1459.98	well, that might sound
1459.98	like were just talking rubbish,
1462.58	but actually this is toughened glass.
1468.22	Well after the house has collapsed
1471.14	and there's nothing there,
1473.06	the glass tiles will still be there.
1476.62	(Applause)
1478.22	CA: I mean, this is cool.
1479.98	So you're rolling this out
1479.98	in a couple week's time, I think,
1482.86	with four different roofing types.
1485.42	EM: Yeah, we're starting off
1485.42	with two, two initially,
1487.98	and the second two
1487.98	will be introduced early next year.
1491.18	CA: And what's the scale of ambition here?
1493.26	How many houses do you believe
1493.26	could end up having this type of roofing?
1499.58	EM: I think eventually
1502.38	almost all houses will have a solar roof.
1507.7	The thing is to consider
1507.7	the time scale here
1511.26	to be probably on the order
1513.74	of 40 or 50 years.
1516.94	So on average, a roof
1516.94	is replaced every 20 to 25 years.
1523.22	But you don't start replacing
1523.22	all roofs immediately.
