startsecond	text
1526.58	But eventually,
1526.58	if you say were to fast-forward
1529.94	to say 15 years from now,
1533.42	it will be unusual to have a roof
1533.42	that does not have solar.
1537.66	CA: Is there a mental model thing
1537.66	that people don't get here
1540.54	that because of the shift in the cost,
1540.54	the economics of solar power,
1544.98	most houses actually have
1544.98	enough sunlight on their roof
1549.1	pretty much to power all of their needs.
1551.18	If you could capture the power,
1553.1	it could pretty much
1553.1	power all their needs.
1555.18	You could go off-grid, kind of.
1556.74	EM: It depends on where you are
1558.3	and what the house size is
1558.3	relative to the roof area,
1561.58	but it's a fair statement to say
1563.46	that most houses in the US
1563.46	have enough roof area
1568.3	to power all the needs of the house.
1571.62	CA: So the key to the economics
1574.82	of the cars, the Semi, of these houses
1578.86	is the falling price
1578.86	of lithium-ion batteries,
1582.78	which you've made a huge bet on as Tesla.
1585.3	In many ways, that's almost
1585.3	the core competency.
1587.58	And you've decided
1589.86	that to really, like, own that competency,
1595.1	you just have to build
1595.1	the world's largest manufacturing plant
1598.58	to double the world's supply
1598.58	of lithium-ion batteries,
1601.74	with this guy. What is this?
1604.06	EM: Yeah, so that's the Gigafactory,
1607.54	progress so far on the Gigafactory.
1610.26	Eventually, you can sort of roughly see
1612.18	that there's sort of
1612.18	a diamond shape overall,
1615.14	and when it's fully done,
1615.14	it'll look like a giant diamond,
1619.78	or that's the idea behind it,
1622.02	and it's aligned on true north.
1623.54	It's a small detail.
1625.3	CA: And capable of producing, eventually,
1629.22	like a hundred gigawatt hours
1629.22	of batteries a year.
1632.42	EM: A hundred gigawatt hours.
1632.42	We think probably more, but yeah.
1635.42	CA: And they're actually
1635.42	being produced right now.
1637.82	EM: They're in production already.
1637.82	CA: You guys put out this video.
1641.02	I mean, is that speeded up?
1642.38	EM: That's the slowed down version.
1644.1	(Laughter)
1645.9	CA: How fast does it actually go?
1648.26	EM: Well, when it's running at full speed,
1651.1	you can't actually see the cells
1651.1	without a strobe light.
1655.06	It's just blur.
1656.36	(Laughter)
1659.82	CA: One of your core ideas, Elon,
1659.82	about what makes an exciting future
1663.42	is a future where we no longer
1663.42	feel guilty about energy.
1667.3	Help us picture this.
1668.74	How many Gigafactories, if you like,
1668.74	does it take to get us there?
1673.78	EM: It's about a hundred, roughly.
1675.54	It's not 10, it's not a thousand.
1677.3	Most likely a hundred.
1679.86	CA: See, I find this amazing.
1681.54	You can picture what it would take
1685.54	to move the world
1685.54	off this vast fossil fuel thing.
1688.82	It's like you're building one,
1691.42	it costs five billion dollars,
1694.3	or whatever, five to 10 billion dollars.
1696.46	Like, it's kind of cool
1696.46	that you can picture that project.
1700.1	And you're planning to do, at Tesla --
1700.1	announce another two this year.
1705.3	EM: I think we'll announce locations
1708.18	for somewhere between two
1708.18	and four Gigafactories later this year.
1711.94	Yeah, probably four.
1713.86	CA: Whoa.
1715.5	(Applause)
1718.14	No more teasing from you for here?
1722.22	Like -- where, continent?
1727.3	You can say no.
1729.26	EM: We need to address a global market.
1733.06	CA: OK.
1734.3	(Laughter)
1735.66	This is cool.
1739.3	I think we should talk for --
1744.38	Actually, double mark it.
1746.02	I'm going to ask you one question
1746.02	about politics, only one.
1750.14	I'm kind of sick of politics,
1750.14	but I do want to ask you this.
1753.42	You're on a body now
1753.42	giving advice to a guy --
1759.78	EM: Who?
1761.02	CA: Who has said he doesn't
1761.02	really believe in climate change,
1763.94	and there's a lot of people out there
1763.94	who think you shouldn't be doing that.
1768.3	They'd like you to walk away from that.
1770.22	What would you say to them?
1772.54	EM: Well, I think that first of all,
1776.18	I'm just on two advisory councils
1778.74	where the format consists
1778.74	of going around the room
1781.58	and asking people's opinion on things,
1784.5	and so there's like a meeting
1784.5	every month or two.
1789.38	That's the sum total of my contribution.
1792.62	But I think to the degree
1792.62	that there are people in the room
1795.42	who are arguing in favor
1795.42	of doing something about climate change,
1800.18	or social issues,
1806.34	I've used the meetings I've had thus far
1809.58	to argue in favor of immigration
1809.58	and in favor of climate change.
1814.46	(Applause)
1816.42	And if I hadn't done that,
1818.54	that wasn't on the agenda before.
1821.38	So maybe nothing will happen,
1821.38	but at least the words were said.
1826.5	CA: OK.
1827.74	(Applause)
1831.62	So let's talk SpaceX and Mars.
1835.18	Last time you were here,
1836.66	you spoke about what seemed like
1836.66	a kind of incredibly ambitious dream
1840.38	to develop rockets
1840.38	that were actually reusable.
1844.7	And you've only gone and done it.
1846.86	EM: Finally. It took a long time.
1848.5	CA: Talk us through this.
1848.5	What are we looking at here?
1851.1	EM: So this is one of our rocket boosters
1853.26	coming back from
1853.26	very high and fast in space.
1857.86	So just delivered the upper stage
1861.14	at high velocity.
1863.26	I think this might have been
1863.26	at sort of Mach 7 or so,
1867.14	delivery of the upper stage.
1870.7	(Applause)
1873.66	CA: So that was a sped-up --
1875.18	EM: That was the slowed down version.
1877.02	(Laughter)
1878.38	CA: I thought that was
1878.38	the sped-up version.
1880.9	But I mean, that's amazing,
1882.26	and several of these failed
1883.62	before you finally
1883.62	figured out how to do it,
1886.58	but now you've done this,
1886.58	what, five or six times?
1889.5	EM: We're at eight or nine.
1891.82	CA: And for the first time,
1893.46	you've actually reflown
1893.46	one of the rockets that landed.
1896.62	EM: Yeah, so we landed the rocket booster
1899.42	and then prepped it for flight again
1899.42	and flew it again,
1902.06	so it's the first reflight
1902.06	of an orbital booster
1907.26	where that reflight is relevant.
1909.26	So it's important to appreciate
1909.26	that reusability is only relevant
1912.46	if it is rapid and complete.
1917.22	So like an aircraft or a car,
1920.5	the reusability is rapid and complete.
1922.9	You do not send your aircraft
1922.9	to Boeing in-between flights.
1927.98	CA: Right. So this is allowing you
1927.98	to dream of this really ambitious idea
1932.82	of sending many, many, many people to Mars
1936.02	in, what, 10 or 20 years time, I guess.
1938.46	EM: Yeah.
1939.86	CA: And you've designed
1939.86	this outrageous rocket to do it.
1943.3	Help us understand
1943.3	the scale of this thing.
1945.74	EM: Well, visually
1945.74	you can see that's a person.
1952.5	Yeah, and that's the vehicle.
1954.34	(Laughter)
1956.02	CA: So if that was a skyscraper,
1957.78	that's like, did I read that,
1957.78	a 40-story skyscraper?
1961.14	EM: Probably a little more, yeah.
1964.18	The thrust level of this is really --
1970.18	This configuration is about four times
1970.18	the thrust of the Saturn V moon rocket.
1976.26	CA: Four times the thrust of the biggest
1976.26	rocket humanity ever created before.
1981.14	EM: Yeah. Yeah.
1984.46	CA: As one does.
1984.46	EM: Yeah.
1985.94	(Laughter)
1988.94	In units of 747, a 747 is only about
1988.94	a quarter of a million pounds of thrust,
1994.94	so for every 10 million pounds of thrust,
1998.06	there's 40 747s.
1999.78	So this would be the thrust equivalent
1999.78	of 120 747s, with all engines blazing.
2006.06	CA: And so even with a machine
2006.06	designed to escape Earth's gravity,
2010.3	I think you told me last time
2011.74	this thing could actually
2011.74	take a fully loaded 747,
2015.02	people, cargo, everything,
2017.38	into orbit.
2018.66	EM: Exactly. This can take
2018.66	a fully loaded 747 with maximum fuel,
2023.82	maximum passengers,
2023.82	maximum cargo on the 747 --
2028.34	this can take it as cargo.
2031.9	CA: So based on this,
2033.66	you presented recently
2033.66	this Interplanetary Transport System
2038.5	which is visualized this way.
2041.9	This is a scene you picture in, what,
2046.7	People walking into this rocket.
2049.3	EM: I'm hopeful it's sort of
2049.3	an eight- to 10-year time frame.
2053.9	Aspirationally, that's our target.
2056.3	Our internal targets
2056.3	are more aggressive, but I think --
2059.34	(Laughter)
2063.42	CA: OK.
2064.66	EM: While vehicle seems quite large
2066.82	and is large by comparison
2066.82	with other rockets,
2069.019	I think the future spacecraft
2073.019	will make this look like a rowboat.
2078.14	The future spaceships
2078.14	will be truly enormous.
2082.86	CA: Why, Elon?
2085.059	Why do we need to build a city on Mars
2089.22	with a million people
2089.22	on it in your lifetime,
2092.3	which I think is kind of
2092.3	what you've said you'd love to do?
2096.3	EM: I think it's important to have
2100.94	a future that is inspiring and appealing.
2103.7	I just think there have to be reasons
2106.499	that you get up in the morning
2106.499	and you want to live.
2109.46	Like, why do you want to live?
2110.94	What's the point? What inspires you?
2112.7	What do you love about the future?
2114.58	And if we're not out there,
2116.1	if the future does not include
2116.1	being out there among the stars
2120.14	and being a multiplanet species,
2121.86	I find that it's incredibly depressing
2124.38	if that's not the future
2124.38	that we're going to have.
2127.74	(Applause)
2131.94	CA: People want to position this
2131.94	as an either or,
2134.3	that there are so many desperate things
2134.3	happening on the planet now
2138.02	from climate to poverty
2138.02	to, you know, you pick your issue.
2142.3	And this feels like a distraction.
2144.86	You shouldn't be thinking about this.
2146.7	You should be solving what's here and now.
2148.9	And to be fair, you've done
2148.9	a fair old bit to actually do that
2151.86	with your work on sustainable energy.
2154.7	But why not just do that?
2159.18	EM: I think there's --
2164.66	I look at the future
2164.66	from the standpoint of probabilities.
2169.1	It's like a branching
2169.1	stream of probabilities,
2173.3	and there are actions that we can take
2173.3	that affect those probabilities
2179.74	or that accelerate one thing
2179.74	or slow down another thing.
2183.82	I may introduce something new
2183.82	to the probability stream.
2190.66	Sustainable energy
2190.66	will happen no matter what.
2192.86	If there was no Tesla,
2192.86	if Tesla never existed,
2195.38	it would have to happen out of necessity.
2198.26	It's tautological.
2199.86	If you don't have sustainable energy,
2199.86	it means you have unsustainable energy.
2203.54	Eventually you will run out,
2205.18	and the laws of economics
2205.18	will drive civilization
2211.02	towards sustainable energy,
2212.7	inevitably.
2213.94	The fundamental value
2213.94	of a company like Tesla
2216.94	is the degree to which it accelerates
2216.94	the advent of sustainable energy,
2221.38	faster than it would otherwise occur.
2224.94	So when I think, like,
2226.18	what is the fundamental good
2226.18	of a company like Tesla,
2228.94	I would say, hopefully,
2230.66	if it accelerated that by a decade,
2230.66	potentially more than a decade,
2236.3	that would be quite a good thing to occur.
2238.46	That's what I consider to be
2240.1	the fundamental
2240.1	aspirational good of Tesla.
2245.3	Then there's becoming a multiplanet
2245.3	species and space-faring civilization.
2251.66	This is not inevitable.
2253.62	It's very important to appreciate
2253.62	this is not inevitable.
2256.34	The sustainable energy future
2256.34	I think is largely inevitable,
2259.46	but being a space-faring civilization
2259.46	is definitely not inevitable.
2264.22	If you look at the progress in space,
2268.42	in 1969 you were able
2268.42	to send somebody to the moon.
2274.66	Then we had the Space Shuttle.
2277.58	The Space Shuttle could only
2277.58	take people to low Earth orbit.
2281.02	Then the Space Shuttle retired,
2282.58	and the United States
2282.58	could take no one to orbit.
2286.14	So that's the trend.
2287.42	The trend is like down to nothing.
2291.38	People are mistaken when they think
2293.78	that technology
2293.78	just automatically improves.
2295.9	It does not automatically improve.
2297.82	It only improves if a lot of people
2297.82	work very hard to make it better,
2302.5	and actually it will, I think,
2302.5	by itself degrade, actually.
2308.3	You look at great civilizations
2308.3	like Ancient Egypt,
2310.74	and they were able to make the pyramids,
2312.7	and they forgot how to do that.
2314.54	And then the Romans,
2314.54	they built these incredible aqueducts.
2317.38	They forgot how to do it.
2320.54	CA: Elon, it almost seems,
2320.54	listening to you
2322.62	and looking at the different
2322.62	things you've done,
2324.9	that you've got this unique
2324.9	double motivation on everything
2327.7	that I find so interesting.
2331.54	One is this desire to work
2331.54	for humanity's long-term good.
2336.14	The other is the desire
2336.14	to do something exciting.
2338.5	And often it feels like you feel
2338.5	like you need the one to drive the other.
2343.22	With Tesla, you want
2343.22	to have sustainable energy,
2346.34	so you made these super sexy,
2346.34	exciting cars to do it.
2350.9	Solar energy, we need to get there,
2352.62	so we need to make these beautiful roofs.
2354.597	We haven't even spoken
2354.597	about your newest thing,
2356.82	which we don't have time to do,
2358.38	but you want to save humanity from bad AI,
2360.74	and so you're going to create
2360.74	this really cool brain-machine interface
2364.06	to give us all infinite memory
2364.06	and telepathy and so forth.
2367.94	And on Mars, it feels
2367.94	like what you're saying is,
2370.66	yeah, we need to save humanity
2374.38	and have a backup plan,
2375.78	but also we need to inspire humanity,
2379.06	and this is a way to inspire.
2385.5	EM: I think the value
2385.5	of beauty and inspiration
2389.3	is very much underrated,
2391.3	no question.
2392.9	But I want to be clear.
2394.18	I'm not trying to be anyone's savior.
2396.02	That is not the --
2398.06	I'm just trying to think about the future
2401.86	and not be sad.
2404.22	(Applause)
2406.34	CA: Beautiful statement.
2410.02	I think everyone here would agree
2411.62	that it is not --
2413.62	None of this is going
2413.62	to happen inevitably.
2415.7	The fact that in your mind,
2415.7	you dream this stuff,
2419.38	you dream stuff that no one else
2419.38	would dare dream,
2421.98	or no one else
2421.98	would be capable of dreaming
2424.66	at the level of complexity that you do.
2428.34	The fact that you do that, Elon Musk,
2428.34	is a really remarkable thing.
2431.54	Thank you for helping us all
2431.54	to dream a bit bigger.
2434.26	EM: But you'll tell me if it ever
2434.26	starts getting genuinely insane, right?
2437.78	(Laughter)
2440.3	CA: Thank you, Elon Musk.
2440.3	That was really, really fantastic.
2443.42	That was really fantastic.
2444.86	(Applause)
